{
  "generatedAt": "2026-10-07T06:16:01Z",
  "indexSequence": 4,
  "releases": [
    {
      "gitCommit": "26b9285c1fe11a3ef875a34ff30faa0275eddf24",
      "launcherSHA256": "sha256:df26969a88b4358d31ffac6eaae2a24787e73f25b98c4b51cb8cde60f18fc73d",
      "manifestSHA256": "sha256:beb78e369c93eb077136c88821776481b9c074e72d1bda63231c4296639375b1",
      "manifestSequence": 1,
      "release": "2.0.3",
      "verifierSHA256": "sha256:0f61c8dc24b627dc46c33c3e8c1e82ffd302bd620851bdfbecf6cda13e60bc47"
    },
    {
      "gitCommit": "c03480b32a26a4756277438507d09769f854d2c2",
      "launcherSHA256": "sha256:94ea1b3238d58462dc7663d7fe59a60d955067ae38f6996061a2b38fded5592f",
      "manifestSHA256": "sha256:b11be23e7c03299c2b761f4231b8afc71b31a4710257a5fbec95ab6952259b99",
      "manifestSequence": 2,
      "release": "2.0.4",
      "verifierSHA256": "sha256:7c414f57a3735d027178cb101e464584166143efa59925ff4f89b72a37ea8f12"
    },
    {
      "gitCommit": "68ce34a032484529104b570d417e29ac8156b080",
      "launcherSHA256": "sha256:94ea1b3238d58462dc7663d7fe59a60d955067ae38f6996061a2b38fded5592f",
      "manifestSHA256": "sha256:0899bbc69e38807f7b2a8caf5dc449c6a57dca978dec8e3bd139194d6a2f1c74",
      "manifestSequence": 4,
      "release": "2.0.5",
      "verifierSHA256": "sha256:7c414f57a3735d027178cb101e464584166143efa59925ff4f89b72a37ea8f12"
    }
  ],
  "schema": "idc-skills-release-index/v1",
  "validUntil": "2026-11-06T06:16:01Z"
}
